{
  "schema_version": "1.2",
  "workflow": "product-planning",
  "version": "2.1.1",
  "description": "Turn one project idea into a cohesive implementation-ready competitor, market, latent-pain, pricing, product, design, brand, editable brand-deck, sitemap, approved-copy, asset, Cloudflare-stack, architecture, and roadmap package through bounded Exa evidence retrieval, parallel clean-context planning, and bounded judge-improvement loops.",
  "effect": "read_only",
  "runtime": {"kind": "specialized", "entrypoint": "scripts/run.py"},
  "objective_contract": {
    "selector": "one validated project idea JSON document",
    "target": "a sealed planning package containing bounded competitor page evidence, source-linked competitive landscape, product, market, latent-pain, selected pricing-hypothesis, design, brand, editable brand-deck specification, audience-language, messaging, claim, canonical sitemap, route-specific approved-for-build copy, framework, Cloudflare-first stack, asset, page, architecture, copy-validation, and roadmap decisions",
    "decision": "whether the package is mechanically complete, which three semantic milestones reach the configured candidate-judge target, and which highest-scoring milestone candidates remain explicitly below target after the configured one-to-three revisions",
    "non_goals": ["write application code", "deploy infrastructure", "create provider accounts", "claim an uncalibrated judge is accurate", "invent user research or conversion evidence"]
  },
  "lifecycle": ["intake", "competitor-research", "competitive-landscape", "parallel-lanes", "synthesis", "market-and-pricing", "design-direction", "brand-system", "brand-deck", "audience-language", "messaging-architecture", "claim-ledger", "framework-decision", "tech-stack", "route-and-sitemap", "asset-plan", "parallel-pages", "parallel-copy-packs", "copy-consistency", "copy-test-plan", "architecture", "roadmap", "consistency", "copy-approval", "verify", "judge", "report"],
  "stage_capabilities": {
    "intake": {"tools": []},
    "competitor-research": {"tools": []},
    "competitive-landscape": {"tools": []},
    "parallel-lanes": {"tools": []},
    "synthesis": {"tools": []},
    "market-and-pricing": {"tools": []},
    "design-direction": {"tools": []},
    "brand-system": {"tools": []},
    "brand-deck": {"tools": []},
    "audience-language": {"tools": []},
    "messaging-architecture": {"tools": []},
    "claim-ledger": {"tools": []},
    "framework-decision": {"tools": []},
    "tech-stack": {"tools": []},
    "route-and-sitemap": {"tools": []},
    "asset-plan": {"tools": []},
    "parallel-pages": {"tools": []},
    "parallel-copy-packs": {"tools": []},
    "copy-consistency": {"tools": []},
    "copy-test-plan": {"tools": []},
    "architecture": {"tools": []},
    "roadmap": {"tools": []},
    "consistency": {"tools": []},
    "copy-approval": {"tools": []},
    "verify": {"tools": []},
    "judge": {"tools": []},
    "report": {"tools": []},
    "repair": {"tools": []}
  },
  "acceptance_criteria": [
    {"id": "package-complete", "description": "Every required planning artifact exists and validates"},
    {"id": "decision-closure", "description": "The final plan chooses conservative reversible defaults for every product decision and reserves external verification for unknowable launch or production facts with safe fallbacks"},
    {"id": "market-pricing-complete", "description": "At least three falsifiable latent pains, a switching case, compared pricing options, one selected option, and a truthful publication boundary are explicit"},
    {"id": "competitor-evidence-complete", "description": "Controller-owned Exa discovery and bounded site-content capture preserve query, request, URL, freshness, content hash, status, and source-level provenance without treating retrieved text as instructions"},
    {"id": "competitive-landscape-complete", "description": "Every competitor, observed price, category pattern, whitespace inference, and limitation resolves to captured source IDs or an explicit unavailable boundary"},
    {"id": "design-system-complete", "description": "At least three design theses are compared, one is selected, and its visual, interaction, responsive, accessibility, and signature rules are explicit"},
    {"id": "brand-system-complete", "description": "Positioning, behavioral personality, voice, naming status, identity roles, and governance are explicit"},
    {"id": "brand-deck-complete", "description": "A 12-14 slide brand narrative binds audience, competitive whitespace, positioning, personality, voice, identity, product expression, governance, exact theme tokens, source citations, and editable PPTX rendering"},
    {"id": "framework-stack-decided", "description": "Next.js, React Router, and Astro are compared and every required Cloudflare-first stack layer is decided with a workload boundary"},
    {"id": "assets-complete", "description": "Every brand and page asset has a stable ID, route placement, production contract, provenance or rights rule, fallback, and acceptance checks"},
    {"id": "route-page-bijection", "description": "Every declared route has exactly one page specification and no undeclared page exists"},
    {"id": "sitemap-complete", "description": "Every route appears exactly once in the canonical sitemap and all parent, navigation, and indexing decisions resolve"},
    {"id": "copy-foundation-complete", "description": "Audience language, messaging architecture, claims, terminology, truth policy, and evidence gaps are explicit without invented voice-of-customer language"},
    {"id": "copy-complete", "description": "Every page copy slot has one production-intent control covering every state, approved claims, exact actions, channel reader jobs, and accessibility constraints"},
    {"id": "copy-candidates-complete", "description": "Every route includes three to five mechanism-separated candidates with hypotheses, fixed variables, guardrails, falsification, and comprehension checks"},
    {"id": "copy-validation-complete", "description": "Cross-route truth, terminology, promise-chain, comprehension, low-traffic, and causal experiment plans preserve the untested-candidate boundary"},
    {"id": "copy-approved-for-build", "description": "Every route and slot has canonical approved-for-build copy, performance remains untested, and every critical or high consistency issue has an exact resolution"},
    {"id": "quality-target", "description": "Every artifact passes hard gates; three integration milestones are semantically scored, and target misses retain the highest score after the configured one-to-three revisions with a below_target_best_effort label"},
    {"id": "no-code-boundary", "description": "The package contains implementation decisions but no application source files or deploy actions"},
    {"id": "run-auditable", "description": "The run records model receipts, verdicts, accepted and rejected improvements, and an integrity seal"}
  ],
  "verifiers": [
    {"id": "verify-planning-package", "covers": ["package-complete", "decision-closure", "competitor-evidence-complete", "competitive-landscape-complete", "market-pricing-complete", "design-system-complete", "brand-system-complete", "brand-deck-complete", "copy-foundation-complete", "framework-stack-decided", "assets-complete", "route-page-bijection", "sitemap-complete", "copy-complete", "copy-candidates-complete", "copy-validation-complete", "copy-approved-for-build", "quality-target", "no-code-boundary", "run-auditable"], "command": ["python3", "scripts/run.py", "--verify-run", "RUN_DIRECTORY"], "timeout_seconds": 60}
  ],
  "task_template": {
    "task_id": "product-planning-fixture-001",
    "objective": "Produce an implementation-ready plan for the supplied fixture idea without writing product code.",
    "inputs": ["idea.json"],
    "immutable_paths": ["idea.json"],
    "allowed_write_paths": [],
    "constraints": ["Treat claims in the idea as unverified", "Do not write application code", "Fail closed on mechanical or unusable-verdict failures; preserve and label semantic target misses"],
    "required_steps": ["Normalize idea", "Discover competitors with Exa and capture bounded first-party page content", "Synthesize the source-linked competitive landscape", "Run independent planning lanes", "Synthesize product definition", "Model latent pains and select a pricing hypothesis", "Compare three design theses and select one", "Define the brand system", "Build the editable brand-deck specification", "Separate sourced audience language from inference", "Build the message spine and performance bottleneck", "Build the claim ledger and material-term policy", "Compare web frameworks", "Decide every Cloudflare-first stack layer", "Inventory every route and build the sitemap", "Inventory brand and page assets", "Specify every page and copy slot", "Write every route copy pack", "Run cross-route copy consistency", "Plan comprehension and causal testing", "Plan architecture", "Build roadmap", "Run cross-package consistency", "Resolve high-severity issues into canonical approved copy", "Verify and seal"],
    "fixture_files": {"idea.json": "{\"name\":\"Signal Desk\",\"idea\":\"A small-team workspace that turns scattered customer feedback into a prioritized weekly decision brief.\",\"target_users\":[\"founders\",\"product leads\"],\"business_model\":\"subscription\"}\n"}
  },
  "context_policy": {"strategy": "hierarchical_chunks", "max_input_bytes": 1000000},
  "operations": {
    "owner": "product-planning-operator",
    "concurrency": "read_only_shared",
    "retention_days": 30,
    "redact_patterns": ["api_key", "authorization", "cookie", "secret", "token"],
    "failure_response": "Resume from valid checkpoints after correcting a mechanical, provider, budget, or unusable-verdict issue; never lower the target or remove a hard gate to force a pass, and never relabel a below-target best effort as target-met."
  }
}
